{"$schema":"https://json-schema.org/draft/2020-12/schema","type":"object","additionalProperties":false,"required":["schema_version","snapshot_id","created_at","fedora_release","parent_snapshot","packages","repositories","rpm_signing_fingerprint","metadata_signing_fingerprint","creation_provenance"],"properties":{"schema_version":{"const":1},"snapshot_id":{"type":"string","pattern":"^repo-f44-[0-9]{8}-[0-9]{3}$"},"created_at":{"type":"string","format":"date-time"},"fedora_release":{"const":44},"parent_snapshot":{"type":["string","null"]},"packages":{"type":"array"},"repositories":{"type":"object"},"rpm_signing_fingerprint":{"type":"string"},"metadata_signing_fingerprint":{"type":"string"},"creation_provenance":{"type":"object"}}}
